{
  "totalRecords": 65,
  "meta": {
    "generatedAt": "2024-07-25T10:30:00Z",
    "source": "audit_schedule_compliance_data_var03"
  },
  "complianceBuckets": {
    "description": "High-performing auditees grouped into compliance percentage buckets (81–95%, 96–99%, 100%), showing auditee count per occupied bucket.",
    "buckets": [
      {
        "bucketLabel": "100%",
        "bucketMin": 100,
        "bucketMax": 100,
        "auditeeCount": 15
      },
      {
        "bucketLabel": "81–95%",
        "bucketMin": 81,
        "bucketMax": 95,
        "auditeeCount": 50
      }
    ]
  },
  "top5HighPerformers": {
    "description": "Top 5 auditees with the absolute highest achieved compliance percentage across all high-compliance buckets combined, sorted descending by achievedPercentage.",
    "items": [
      {
        "auditeeName": "Delhi Metro Project",
        "achievedPercentage": 100
      },
      {
        "auditeeName": "Mumbai Coastal Road",
        "achievedPercentage": 100
      },
      {
        "auditeeName": "Bengaluru Tech Park",
        "achievedPercentage": 93.5
      },
      {
        "auditeeName": "Hyderabad Pharma Unit",
        "achievedPercentage": 92.1
      },
      {
        "auditeeName": "Chennai Automobile Plant",
        "achievedPercentage": 88
      }
    ]
  },
  "zoneComplianceOverview": {
    "description": "Count of audits per zone where Achieved Percentage > 50%, sorted by count descending.",
    "highComplianceThreshold": 50,
    "zones": [
      {
        "zoneName": "North Zone",
        "highComplianceAuditCount": 20
      },
      {
        "zoneName": "South Zone",
        "highComplianceAuditCount": 15
      },
      {
        "zoneName": "West Zone",
        "highComplianceAuditCount": 10
      },
      {
        "zoneName": "East Zone",
        "highComplianceAuditCount": 8
      },
      {
        "zoneName": "Central Zone",
        "highComplianceAuditCount": 5
      }
    ]
  }
}