{
  "totalRecords": 65,
  "meta": {
    "generatedAt": "2024-10-25T10:30:00Z",
    "source": "audit_schedule_compliance_data"
  },
  "complianceBuckets": {
    "description": "High-performing auditees grouped into compliance percentage buckets (81–95%, 96–99%, 100%), showing auditee count per occupied bucket.",
    "buckets": [
      {
        "bucketLabel": "100%",
        "bucketMin": 100,
        "bucketMax": 100,
        "auditeeCount": 1
      },
      {
        "bucketLabel": "96–99%",
        "bucketMin": 96,
        "bucketMax": 99,
        "auditeeCount": 1
      },
      {
        "bucketLabel": "81–95%",
        "bucketMin": 81,
        "bucketMax": 95,
        "auditeeCount": 1
      }
    ]
  },
  "top5HighPerformers": {
    "description": "Top 5 auditees with the absolute highest achieved compliance percentage across all high-compliance buckets combined, sorted descending by achievedPercentage.",
    "items": [
      {
        "auditeeName": "Mumbai Flagship Store",
        "achievedPercentage": 100
      },
      {
        "auditeeName": "Delhi Central Office",
        "achievedPercentage": 97.5
      },
      {
        "auditeeName": "Kolkata Regional Hub",
        "achievedPercentage": 88
      }
    ]
  },
  "zoneComplianceOverview": {
    "description": "Count of audits per zone where Achieved Percentage > 50%, sorted by count descending.",
    "highComplianceThreshold": 50,
    "zones": [
      {
        "zoneName": "North Zone",
        "highComplianceAuditCount": 10
      },
      {
        "zoneName": "South Zone",
        "highComplianceAuditCount": 8
      },
      {
        "zoneName": "East Zone",
        "highComplianceAuditCount": 5
      },
      {
        "zoneName": "Central Zone",
        "highComplianceAuditCount": 3
      },
      {
        "zoneName": "West Zone",
        "highComplianceAuditCount": 1
      }
    ]
  }
}